Quality,Difficulty,Grade,Comment1.0,3.0,N/A,"Never ever take a course with Kass Banning. She made a remark about a student's mental health very lightly and was rude and disrespectful towards student contribution. Everyone felt uncomfortable. Although her slides are easy to follow, she sometimes goes off topic and is very condescending . She requires students to sit in the front. Can't be late"
1.0,4.0,N/A,Disorganized lectures and difficult reading material. Wastes lecture time to tell irrelevant stories and jokes only she thinks are funny.
4.5,4.0,N/A,"Very helpful, but don't miss any of her lectures!"
5.0,4.0,N/A,"If you want to gain the most from taking one of her classes, make sure you've done intro to film, in addition to film cultures 1 and 2. Also, she's extremely caring and helpful when it comes to papers - if you need help, ask for it! Her lectures are interesting and take from the readings quite a bit, she does an excellent job of summarizing."
3.0,3.0,N/A,"The course pack is interesting but her lectures are disorganized, she interrupts students, she doesn't clearly tie together readings+films+lectures and despite the class goal of countering eurocentrism she kinda falls into that trap sometimes."
1.5,3.0,N/A,Kass Banning is extremely disorganized in her lectures. She makes the students do useless presentations instead of actually teaching the course material herself as a professor should. She concerns herself more with asserting her power to fulfill her ego. Extremely  upsetting that such a person has hi-jacked all the upper year courses
4.0,5.0,N/A,"Very helpful and cares about students, but difficult material and lectures not terribly illuminating."
4.0,4.0,N/A,"One of the best lectures I've ever heard came from Kass Banning. Quirky, but approachable and supportive."
2.0,4.0,N/A,Interesting course pack...but VERY difficult to get through. One of the biggest I've ever used; most of it was useless and made the course more confusing. Lectures were disorganized and often unfocused. Two hard midterms and an *impossible* exam!
2.0,4.0,N/A,"She is a nice prof and helpful.Kass cares about her students. However readings were at times hard to understand, and readings were too long."
2.0,2.0,N/A,"Incoherent lectures, constantly interrupts students.  Dazzle her with fancy writing and ideas."
1.0,5.0,,"This is the most rude disrespectful prof I have EVER had. Her lectures are extremely hard to follow, and she is rude to all students who are simply trying to learn. I will never take a class with this prof ever agian."
3.5,3.0,,"Lectures tended to be hard to follow. Much better in discussion or one-on-one scenarios. Very knowledgable. Extremely nice, helpful and encouraging. Sad she's gone from UofT."
3.0,5.0,,The tutorials were a mess--not very helpful at all. She tried to break down the material but was disorganised for the most part.
1.0,5.0,,"She is extremely critical and rude. Her classes are disorganized and her ideas are all over the place. Nobody ever knew what she was talking about, her lectures are a series of digression after digression. Awful. She was the worst prof I've ever had!"
1.5,4.0,,No Comments
3.5,2.0,,"She's funny!  Course material isn't easy, but she genuinely tries to 'unpack' it for you in tutorial. Very bright woman.  I like her quirks.  Understanding, as well."
4.5,2.0,,wonderful professor. cares about the students quality of learning. very knowledgable. she's my favorite prof in the cinema department.
2.0,5.0,0,"Difficult material and the prof does not help to explain.  Instead of telling lame jokes, he should spend time trying to actually ensure the students understand the material.  It's like being tought microeconomice by Erkel."
5.0,1.0,0,"Absolutely the best! This man knows his stuff cold.  Pay attention in class and you'll get an A.  If you are hoping to laze your way through this class, then, don't bother registering.  GREAT JOKES !!!"
5.0,3.0,0,Extremely knowledgeable. Makes the effort to ensure that students are learning. Puts economic theory in a relevant real-world context. One of the very best !!!
1.0,4.0,,"Totally a nerd + geek, his lame jokes are very annoying, the only person who laughs is him.  Can't teach, lectures/notes are confusing.  Don't enrol in his class, you'll regret it."
1.5,3.0,,"Exams were ok, but never reply any email, and impatient when answering student's questions.  Makes mistakes on the board all the time, notes are confusing.  Marks might be ok, but you learn nothing."
1.5,4.0,,"Nerdy prof, lame jokes and thinks he's funny.  Materials not related to tests/exam.  Rude, doesn't answer email questions AT ALL.  One word, drop."
1.0,5.0,,"One of the most useless and bad prof in U of T.  He should stay at York, he doesn't belong to U of T."
4.5,2.0,,he is a good prof.... his tests are a bit hard though
3.0,4.0,,beware!!! He will foul you with lame jokes and a nerdy attitude making you feel comfortable. When you least expect it he will kill you when you are writing the exam.
2.5,5.0,,exam super hard.. unfair marking.. and he lost my midterm when i asked for a remark.  his lectures are ok but exam's a diff story.
3.0,2.0,,"Very lame jokes, but better than nothing when learning economics.  Very weird teaching, sometimes will not go through the variations in the macro models, and will put them on the tests and exam.  But if u just do your work you'll get a B.  Not bad."
4.0,4.0,,"lame jokes, lame material, friggin hard exams, but overall good course"
2.0,4.0,,A total freak! He is going to fool you with his laid back style and flat jokes about his dumb car. Ridiculous marking!
3.5,1.0,,Nice person... but what happened in the exam?
5.0,3.0,,"Excellent Prof. Take a course with him , you won't regret it..."
1.0,3.0,,no practice at all...and not so good at specifying expectations
2.5,5.0,,"No practice questions & thus unfair tests, textbook isn't needed, flat jokes"
1.0,2.0,,No Comments
1.0,3.0,,worst prof ever! not helpful
5.0,1.0,N/A,looks like eddy murphy ^0^
3.0,4.0,A-,"Proper prof from the old school. Fair and knowledgeable. He'll call you out if you're just speaking for the sake of hearing yourself. Doesn't let students hijack lectures. Won't boost your grade just because you occasionally visit him during office hours. If you think he's mean or unfair, re-evaluate your idea of teaching  learning. "
1.5,3.0,,"The rudest, most uninspiring, bitter, and forlorn professor.  He seems to have an anger against the world.  He actually made a student cry in front of class once.  He did't hesitate to call students "" stupid "" or ask outright, "" How did you get into University ?! "".  Very dishevelled, looks **** all the time."
1.5,4.0,,"He mummbles a lot during his lectures, making it very difficult to understand what he is saying. I think he forgets we pay to take his class. He is extremely rude to students when there is no need for it- e.g. always wants students to ask questions, but responds rudely when they ask"
1.0,3.0,,"He mumbles about crap in his lectures.  He seems to be very angry, **** and disorganized all the time.  Does not know the meaning of "" human integrity "".  Once asked someone in front of class, "" How the hell did you get into University?"" and with that, I often wonder how the hell he got into the UNiversity bc he treats people inhumanely."
3.5,3.0,,"he's not that bad, and has a good heart. also very smart. the guy who says he's from harvard law, i don't believe you! how do you have enough time to cruise this site, lol... you don't have to lie: you can just say you think Art sucks"
3.5,3.0,,Great Prof.  I had him for international relations & american foreign policy.  He remembered me from my writing from the first course.  So don't think he doesn't know you.  Very strict in his classes but overall not a bad guy.
3.5,4.0,,"He's a good professor and knows a lot about the material he teaches. He seems strict and rude, but that's just his mannerism. He's not unreasonable, and his exams are straightforward. A lot of req'd reading, so be prepared to put in the effort and time."
1.0,5.0,,Terrible professor. The worst I ever had in university.
1.0,5.0,,"This guy is a clown of the highest order.  He once told me, my knowledge of American government would always be limited.  Now that I've graduated from Harvard Law School and am actively involved with the DNC in Washington, I guess we know who was wrong."
5.0,3.0,,"Good Prof. Very smart and knowledgable about politics, although you have to work hard to do well - should it be any other way?"
4.0,4.0,,hes a tough nut to crack
2.0,5.0,,"Worst Professor I had while at UofT.  He made a student cry during her presentation because he disagreed with her.  I dislike him not only as a Professor, but as a human being."
2.0,4.0,,Don't let his after class charm fool you.  His essays on Diplomacy were marked terribly by a disgruntled T.A. and Rubinoff did nothing about it!!!  Average on the essay was below 50%!!!!!!!!
1.0,5.0,,No Comments
4.5,3.0,,No Comments
2.0,4.0,,"Very intriguing, but tough"
2.5,3.0,0,"Had him long ago.  He was late to every class. Midterm grade was strangely low. He said - You didn't submit your paper...I said...yes, I did... and it is lying on the floor under your desk with a bunch of others.  He had to add about 40 points to my grade.  And adjust for all the others he had dropped on the floor.  Self-centered. Oddly arrogant."
4.5,2.0,0,"my favourite prof at mcgill!  very helpful, really knows his stuff.  i suggest this class to any econ major that wants to take a break from really mathematical and dry theory classes."
2.0,4.0,0,Yawn.... attended class a few times but learned close to nothing. I taught myself the textbook instead.
1.0,4.0,0,a very poor prof to say the least; can be unduly rude in person; very impatient if you disagree with him - even on academic issues; at times a very bitter man
4.0,1.0,0,"I've taken his class three times now.  Best class in economics.  Hopefully I will get him one more time before he graduates.  Don't bother with the readings, they are never on the exam."
4.5,3.0,,"Boring? Yes. But this guy knows his stuff and his lectures are pretty useful. His Final Exam however was not in the traditional Econ format, however it was fairly straightforward for those who studied and didn't cram the information in at the last minute."
1.0,3.0,,"For this class (econ) 209 the proffessor just seems like he does not care, he is always late, talks about the topics as though people actually memorized the text, plus you'll be stuck with short answer questions on the final versus all other sections who have multiple choice. Finally, this teacher talks as though he has crackers in his mouth"
4.5,2.0,,"One of the best profs I've had at McGill. He is so smart, handsome, verry funny and witty, and everything he says in class is meaningful. For this class, I didn't even buy the book, but went to classes everyday and took good notes. Do this and you'll be fine!"
2.5,2.0,,I went to four classes: the first two of the semester and the two quizzes we had. I didn't find the lectures helpful. Study the book and do lots of exercised and you'll be fine.
3.5,2.0,,"Great prof to go to with questions/requests for advice, which is sorely needed at McGill.  So even though his lectures can be all over the place remember he is pretty nice if you talk to him, but keep in mind he can be a bit blunt."
2.5,4.0,0,"one of these guys who was an anti-social nerd in high school who now finally has to learn how to interact with other human beings...at your expense. though the prof.'s a genius, don't go to lectures. the exams are pretty random but somehow you don't fail. study like it's your job and forget lectures."
2.0,3.0,,"Unhelpful Prof; isn't a good teacher and can't maintain a focused lecture. While ocassionally kind, he can be very odd in one-on-one discussions."
2.5,2.0,,"terrible at equations, but very fair exam. Overall nice prof, fair grading, but his lectures are unbearable especially for the math part."
4.5,3.0,,"Really nice guy, helpful if you go to see him, but he tends to go off on tangents in class and expects a lot of you for the final exam."
4.0,4.0,,"While lectures were not his strongest point, Grantham gave lots of time in office hours and really helped me improve my writing style.  Really nice and helpful guy, with lots to say, just be sure to excuse yourself if you need to go."
3.5,3.0,,"Pretty nice guy.  Course isn't that interesting, but he sure does know his stuff."
1.5,4.0,,He is a very smart and interesting person. He can't teach and his lectures are read. He doesn't answer your questions rather answers his own.
1.0,4.0,,"horrible prof. AVOID HIS COURSES. superficially nice guy, but can't teach to save his life; will shaft you (grade wise) if you disagree with him regarding anything significant"
5.0,4.0,,"very interesting, hard tough (as you would expect from an honour course)."
1.5,5.0,,avoid if possible
5.0,3.0,0,Based old man. Smart as a whip. My second favourite philosophy prof. His seminars were always a highlight of my day.
5.0,3.0,B+,"The seminar I took with Dr. McCall (Topics in Philosophy) was a delightful class. The topic discussed was decision-makingi.e. themes of deliberation and determinism. He is brilliant, humble, and endearing in a grandfatherly way.  I always left his class inspired and cheerful."
4.0,2.0,B+,"Professor McCall is a charming old man (late 80s) who's been doing philosophy for ages. I had him in a very small class (15 people) on a subject which he loves (Time). At this very personal level, he was extremely friendly. His marking is very fair if you show the slightest interest in his work. Take a class with him before he retires!"
4.0,2.0,B+,"Phil of Law with Storrs was fun! The concepts were really interesting and there was barely any theory involved, just a lot of talk about real life examples and hypotheticals. The papers were interesting and marked fairly."
4.0,2.0,B+,"You need to take this man before he retires finally. Go to lectures, don't screw around on your laptop, and listen to his lecture, it's worth it. He is in his late 80s, has been doing this course for literally decades, but is still incredibly passionate, which will rub off on you. Standing ovation at the end of the last lecture."
4.5,2.0,B+,"Storrs McCall is a fantastic professor, brilliant intellectual, and a great man. The class is very interesting and he has a way of engaging the class in discussion."
4.5,3.0,B+,"He's really good at explaining the book, and that's really helpful because the books that we read for this class were not the easiest (Plato and Descartes, especially). Having a nice TA matters 'cause TAs grade your paper."
2.5,4.0,B+,"McCall is hilarious - keep track of his comments cause he's so funny ... but in terms of lecturing, he tends to talk in circles for most of the class about one vague point so you tend to zone in and out of paying attention. He's super sweet though, awesome prof. TA's mark hard at first, but they easy up as the term goes by."
4.0,2.0,B+,"storrs is easily the best philosophy prof i have ever had. such a cute old grandfatherly figure. i looked forward to his class each day. work load really isnt that challenging.. just four short papers. TAs are fairly tough at first, but once you know what they want its much easier"
3.0,2.0,B+,"no use in going to class, he just explains everything from the books. go to class for a fun time though, cuz storrs is the boss. he will give extremely clear examples so id you read something and don't get it, just go and it'll all make sense. don't challenge him, he's always right. very light work, only 4 essays and an exam."
5.0,2.0,B+,The most attractive man I have ever met. His intellect is something we can only aspire to.
4.5,2.0,B+,"Most adorable old man ever - spent class wishing he was my grandfather and restraining myself from getting up and hugging him! It really is story time with Storrs. Take this class before he retires, but to be honest you might find the readings a bit confusing if philosophy isn't your cup of tea."
4.5,2.0,B+,"McCall is the cutest old man alive. Each class is like story time! He's so nice and clear in lectures. I'm going to miss him so much! Class is not hard if you attend lectures and read the material. Four essays, 500 words, 15% each + Final exam. Not hard for a first year class but lots of reading! But it was all worth it for McCall!"
5.0,3.0,B+,"this class got me through first semester. he's so entertaining, going to miss him! i hope he knows he has inspired many of his students!"
4.5,2.0,B+,"Storrs is a sweet, adorable, old man, but this class is VERY basic. It is actually quite boring. The readings are easy and he goes over them in detail. He isn't responsive to objections though...Michel-Antoine Xhignesse better be your TA! He's hilarious and EXTREMELY helpful- a stickler for structure, but actually goes over the material in depth."
2.5,4.0,B+,Hard but awesome
2.0,4.0,B+,"Storrs is a cool guy, too bad he doesn't run the class. TAs are horrible and you will want to stab yourself during every conference. They are incredibly boring and the essays are marked without mercy. I advice you not to take the class. Join some reading group at your local library and you will probably learn the same amount."
4.0,3.0,B+,"Probably the most learned man I ever met at McGill - a pleasure to attend his class. He made philosophy interesting, but sometimes what he says can go way over my head. Take his course though, the final is easy if you study hard for it."
5.0,3.0,B+,"Fantastic Prof, fantastic course.  I'm actually sad that it's over.  Take it."
4.0,4.0,B+,"He is the JEWEL of McGill!!! If you are at McGill, and at least somewhat interested in Philosophy, seriously consider it. One of the very few profs at McGill that you actually sense fine wisdom without being intimidated. Lectures can be intense and papers can be difficult to grasp! (experience can be exponentially enhanced by choosing S/U option)"
5.0,4.0,0,"Brilliant, funny, cynical. Critical towards news, research, what she teaches and how she teaches : open-minded and energetic, she gives a demanding but excessively rewarding class. Naysayers will mistake her recent or unconventional data for factual mistakes : please be smarter than that."
4.0,2.0,0,"Pr.Lupien is very dynamic and clear in her explanations of the materials.She has her own ways to explain certain concepts that you may find very helpful.Her playfulness is nice but maybe towards the end a little over the top. Other than that, she is very approachable and overall it is a pleasure to go to class.Watch out for the group project though"
1.0,2.0,0,"I had a BIG problem with Prof Lupien. She said things that were incorrect in many of the lectures. She ACTUALLY said that neurotransmitters travel in vesicles after they are released!  If you took any physio course you will be angered by her mistakes, otherwise you won't know the difference. Easy A either way, no need to think..."
4.0,3.0,,the class is really interesting and she explains things well. her assignment isnt explained well though..the TA was really helpful as well(Rok!).the first month is very scientific but the next 2 months are the interesting parts so if u could get through the first month youll be fine
5.0,2.0,,"It's really too bad she doesn't teach more classes. Absolutely wonderful teacher. Her explanations are clear, fun, and up to date. She has a true passion for teaching as well as for the material she teaches."
4.5,3.0,,"Honest to goodness, take this course. Always interesting and stimulating. Dr. Lupien is clear, energetic and has a way of making everything interesting. Best course I have taken so far."
4.5,2.0,,"it really does seem like the best class in Mcgill! If it doesn't seem like this in the beginning, it will definetly seem like it in the end of the course and even after the course. You will be sitting in your other courses and wishing for DR Lupien to be your teacher: yes she is that good! Bonus: TA"
4.0,3.0,,"wonderful professor. highly demanding, but it pays off. i loved that she expected creative thinking and more than just regurgitation."
5.0,2.0,,"wow what a class
 non cumulative exam but actually forced to think and understand instead of regergitate 100 multiple choice
 interesting material all great teacher
 probably my fav class at mcgill so far 
 highly recomended for anyone"
5.0,1.0,,"Don't know if this matters but Lupien is freaking gorgeous. She gets my testosterone going so much, it shuts down my HPG axis. If I were a woman, I'd have an LH/FSH surge all over her. She's like Celine Dion but: a) HOT b) not old c) SMART and d) FINE"
4.0,3.0,,"I didn't realize how much I took away from this course until after I took it.  Lupien stresses critical thinking from all aspects...and that has not only helped me in my psyc and science courses, but it's helping in all aspects of my life. GREAT course!!"
5.0,3.0,,"Very interesting teacher. Knows how to grab student's attention and hold it for the duration of the class. Hard exams, but worth studying for. Celine Dion should be proud to have a resemblane to such a cool prof;)"
4.5,3.0,,"Really engaging, really funny. Pretty tough but refreshing to listen to."
4.5,3.0,,amazing teacher! really knows what she is talking about.  looks a little bit like celine dion hehehe
4.0,3.0,,No Comments
4.0,4.0,,"Demanding of herself and of students, good teacher, sarcastic in a funny way"
3.5,2.0,,No Comments
4.5,4.0,,"very clear, interesting, dedicated.  tough course butbest prof ive had at mcgill"
5.0,2.0,,No Comments
4.0,3.0,C,No Comments
4.0,3.0,A-,"Chris Green is a great professor, whose only downfalls are that he's pretty advanced in age. His voice is a bit weak, and some of his presentations are outdated. That said, I would highly recommend this course to anybody who is interested in taking a history-based approach to economics."
4.0,4.0,A-,"Professor Green's teaching style is not for everyone, but he understands that and makes it clear from the very first day. If you don't take it seriously to begin with it's your own fault. That being said, Professor Green is incredibly knowledgable and very passionate about the subject. Possible to get a lot out of class but it's up to you to try"
5.0,4.0,A-,"Prof Green is the kind of Economics Professor I wish I had had earlier in my McGill career. He's incredibly knowledgeable about the material he teaches, though occasionally the lectures can be fairly dry. Very open to questions and willing to discuss ideas in depth."
1.0,4.0,A-,Holy he just threatened us that if ask to get a paper remarked he will drop the marker... How is he allowed to work.
1.0,3.0,B-,... he literally just said there's no actually grading scheme for this midterm. What did I write and what did he grade -_-
4.0,4.0,B-,"One of my favourite Econ professors at McGill. Sometimes borderline paternalist in his Chinese Econ lectures, but have taken multiple other lectures with him and the extent of his knowledge is invaluable. One of the only econ profs who will ground the material in real life and offer a bigger picture. Willing to help and a funny guy."
3.5,4.0,A,He's seriously one of the best econ profs at McGill. SUPER dedicated to his craft of teaching & the material - his ppts are detailed & he constantly updates himself on the info. He always makes time for students... He might not be the most friendly but he's really respectful & humble. His course isn't an easy A but it's priceless. 
3.0,3.0,B,"Goes off tangent with background info on whatever topic he is lecturing during class so it can be hard to follow sometimes. The PowerPoints are very clear and detailed so despite not doing all the massive assigned readings, you can still do very well for the final if you studied the PowerPoints well. Grading was 50% Term Paper50% Final. "
5.0,3.0,B,"This guy is the nicest, most dedicated professor I've ever met at McGill. He's patient, attentive to students, and truly loves teaching. The course requires some work and the grading isn't the easiest, but it's really all been worth it. I also recommend for students who want to go to law school."
4.0,2.0,B,"Prof. Green is really nice and very helpful if you go to see him. He's also extremely knowledgeable on the subject! Sometimes his lectures are a bit disorienting, but this class is pretty unique and definitely worth taking. If you do the readings its great."
5.0,1.0,B,Chris Green is literally the best person/professor I've ever had at McChill.
1.5,4.0,N/A,"Chris Green is an old and dogmatic professor, often very confused with his material and unable to speak a sentence without losing track of what he is saying.The class is interesting, be but careful, there is ALOT of material covered. Going to class is useless, just do the readings and read the slides. Overall interesting material but boring prof."
2.0,3.0,N/A,"Whatever everyone says, this class is NOT hard. Just read the course pack carefully and you don't even have to go to class all that much. The stuff is interesting, not gonna lie, competition policy and the feud between company mergers are way more interesting than economic calculations I've done in other classes."
4.0,3.0,N/A,"this man is a huge beauty and adorable- the subject matter of this class is dry but it's not his fault. he makes it more interesting and you can tell he loves it. he explains things really clearly and is clear about what to know for the exam, and you actually learn. would highly recommend taking this class"
