Quality,Difficulty,Grade,Comment
4.0,3.0,A+,"Great dad joke style lecture! He cares about his students' understanding and wants his class to do well. The course has a very clear grading scheme -- webwork, 1 midterm and then the final. Half of the course is all highschool calc stuff (up until the MT) and then the rest is mostly new university calc topics which makes the final a bit harder."
5.0,4.0,A-,"One of the most charismatic professors I had first year. He speaks with a New York accent and will rarely go longer than five minutes without some sort of joke or witty comment. He also does a good job of structuring his lessons, complete with titles, references to an online textbook, and rating the difficulty of example questions. Phenomenal prof!"
5.0,3.0,A+,"Fantastic professor. He explains everything clearly, his notes are great and the pace of the class is perfect. Mind you math 101 is not an easy course but Professor Ward really explains what you need to know as well as techniques to get a good understanding of the material so you can get a high grade."
5.0,2.0,N/A,"I really cannot understand the people here complaining about his notes! The most organized and complete course notes I have ever seen, covering everything you will need to know. He cares a lot about teaching and the ""hard testing"" is completely fair game since the material is covered in class. Inspirational and brilliant. He makes you love Math!"
5.0,3.0,N/A,"This prof is the best prof Ive ever met! So good at teaching, able to answer all questions thrown at him. He makes sure that people understand the material. He also makes dad jokes in most of his classes. I would consider him a fatherly figure. I look up to him very very much."
5.0,3.0,N/A,"He is a gem. He is charismatic and does a very good job into making what is supposed to be the hardest Calculus course (out of Calc 1-2-3-4 series) entertaining and easy to follow. I have enjoyed his lectures so much until now, that I'm looking into taking another MATH course of him just for fun, or add an Honors Math minor to my degree. AMAZING!"
5.0,4.0,N/A,"I want to give a big shoutout to this professor. His course material is difficult, but I can see that he invested and continues to invest hours of his own time to help students who are struggling. The notes he posts on the webpage are handwritten, but are meticulously detailed. If I ever become a teacher this is the kind of guy I'd like to be"
5.0,4.0,N/A,Math 101 is by far the heaviest of all First and second year math courses of ubc. So much new stuff in one course. Micheal had great lectures and notes that helped a lot. You have to work yourself too because of the material. Brilliant man and very helpful to students.
5.0,4.0,A-,"Simply one of the greatest professors you will ever have. If you have the opportunity to take his class, DO IT. He is hilarious in this dadjoke kind of way and because of his experience, he knows the best ways to simplify the content so that we understand it. This course is hard, maybe brutally so, but I wouldn't take it with anyone other than Ward"
5.0,4.0,B,"The course is hard, but he teaches it as well as anyone could. His lectures have good structure to help you learn the basics of a concept before learning harder applications. He is enthusiastic and cares about how the class is doing."
5.0,3.0,B,"He is very caring about his students and really wants to see them succeed, but that doesn't mean tests will be easy. Very helpful in office hours and willimg to take time to make sure you understand."
4.0,3.0,A+,"You really learn something out of this course. Homework might be a little too much, yet is worth it."
5.0,4.0,A+,"Great lecture notes. Very invested in his student's success. Fair grader, great teacher."
2.5,5.0,A+,"Skips key steps in homework solutions, which gets rid of clarity you would hope the solutions would provide. Hard homework problems that class won't prepare you for. Be ready to be tested on all the math you've ever learned, not just what he teaches you in the course. Don't skip class, don't be late (or you'll be too busy writing to listen). "
5.0,1.0,A+,Perfect
3.0,4.0,A+,"Super clear in teaching, posts ambiguous and long homeworks, midterm was too long for the designated time, and I don't recommend taking courses with him unless you don't care about your grade."
5.0,1.0,A+,"He is just amazing. If you like math, you would love it after taking any course with him. You'll see someone on the peak who can explain easy and hard materials for you. HWs are time consuming, exams are really hard. but you will take something home from every single one of his classes."
5.0,3.0,A+,"For people who complain about him, idk what more they ask from a math prof. Ward is one of the best math profs I ever had (Anthony peirce too). His exams are way harder than hw, he posts all his notes online and the notes are very neat, but obv going to class helps understand the notes. Classes were a bit slow, but full of lots of examples."
5.0,4.0,A+,"Great professor!  He will challenge you.  He presents difficult ideas clear and effectively.  Be prepared to put a lot of time into this course if you want to do well.  There is no time to think on exams, so be a machine by at solving the problems.  The homework is time consuming, and the exams are a level above the homework."
5.0,3.0,A+,"He is a great prof, as long as you have a good math foundation, he will be able to teach you a lot! On the other hand, if you suck at math, don't blame him, he isn't there to teach the easy stuff.  His goal is to challenge the students, and give meaning to an A or A+."
5.0,4.0,0,"Man I absolutely love George, one of my fav profs at ubc, even though i'm now in my fourth year. The guy is a fantastic teacher and genuinely cares if the students are with him, he uses clickers very effectively, going over topics until people understand them. An absolute gem, in the CPSC department, a god among men."
4.0,3.0,A,good guy george
5.0,1.0,A+,Great professor who cares about his students. He is also very friendly and extremely hilarious. Assignments and exams are fair if you put the effort in.
3.0,2.0,A+,"Seems like an incredibly great guy and delivers a lot of passion to the lecture hall. That said, he does not prepare well for class, is often late and stumbles over his explanations. Could do with a lot more rehearsal."
5.0,1.0,A+,"A great professor who really cares about his students. Engaging and informative lectures, and absolutely hilarious. Also very fair exams and workload."
2.5,3.0,A-,"George is a great guy; his lectures are entertaining and he is very approachable. However, he sometimes gets confused with some of the material, which in turn confuses students. You'll have to get used to the accent, but it's nothing major. I really liked his class. His exams are fair and so is the grading. "
2.5,4.0,A-,"Hard to understand. Says stuff like, ""how the step is gonna look like?"" I think he means, ""what is the next step?"" but it's hard to tell. Lecture slides are half written and inherited from another prof. Nice guy, pretty funny and also helpful if you talk to him. The lectures would be better if he wrote his own notes, or just wrote on the board."
4.5,2.0,A-,"He's a great prof. Everyone loved him in our class. He's amusing and enthusiastic, I liked listening to his lectures. His accent is thick, and it was difficult to understand for the first two classes, but afterwards it wasn't a problem at all. I would definitely recommend him, he's a caring prof who's passionate about his subject. "
5.0,3.0,A-,"Great professor, will definitely be looking to take a class with him again. Lectures were always fun and informative. Don't listen to all the people saying they couldn't understand him, he is more then easy to understand. If you are fluent in English you will not have a problem. "
2.5,1.0,A-,"Material is easy. I can't understand anything he says, so there is no point to attending his lectures if the 3% iClicker marks aren't important to you.   Not to say he's not a good guy. He's pretty awesome. "
3.5,4.0,A-,Needs a while to get used to his accent.
2.5,5.0,A-,Useful material but very likely to lower your GPA. I would not take this class unless you need it for something specific.
5.0,2.0,A-,"No one can explain a concept as clearly as George. He's a wonderful prof; very kind and patient too. Labs were fun, classroom lectures  were lively, and if you ever go to his office hours your confusions will be swept away by his clarifications. Labs were relevant to student learning and he cracks jokes every once in awhile. Fantastic time in 213."
4.5,2.0,A-,Best professor.
4.0,2.0,A-,"I've had George 3 times already, and each time he has proven himself one of the best CPSC instructors at UBC. The accent at first may be difficult, and he has to backtrack a lot, but the most helpful and caring prof around!"
4.0,3.0,A-,"Amazing prof! Knows what he's talking about, negotiable and approachable in office hours, and once you get past the accent, will explain anything you ask well and passionately. Definitely taking another course with him."
4.0,1.0,A-,"George is rad, he has a little bit of an accent which honestly helps get you through how dry the course material can be at times.  I literally jumped for joy when I realized I had him again next semester."
5.0,2.0,A-,"Following George, you will achieve success easily!"
4.0,3.0,A-,I recommend taking this course with George - he put a lot of effort into the in-class examples. He has a bit of an accent but it only adds to the hilariousness of his jokes! Ops! He really seems to care that his students understand the material. It's a definite advantage for CPSC 313.
4.0,2.0,A-,"George is a really funny and caring professor who needs to get more sleep at night. His accent can be a bit difficult to understands and the lectures fairly dry from time to time but that's life. The course content gets progressively more difficult as it goes on. He can be very lenient. Don't bother asking him ""do you even lift?"" The answer is yes."
1.0,5.0,0,"The comment below me, that says he sucks? Well he does, AVOID UNDER ALL CIRCUMSTANCES IF POSSIBLE!!! I feel bad for the students who have to take his class, get ready to lose all interest in coding"
1.0,5.0,0,"In one line, quite possibly the worst teacher I've ever had. He will spend all lectures talking about memory, and then the midterm will have one question on it worth only 5%. Refuses to help, and isn't even nice about it. Single handedly made me lose interest in coding, which was my favorite topic prior to him. Highly unrecommended, just terrible"
1.0,5.0,0,"Completely useless prof, goes on tangents unrelated to the topic at hand regularly. Highly unrecommended."
1.0,4.0,0,"Hardly ever taught on code writing. Going for lectures is a waste of time since you won't learn much and to do the labs, you'll probably need to google most of the stuff or ask the TAs. The TAs are more helpful than he is."
1.0,4.0,0,"Ineffective instructor. Never taught anything about writing code. Tests were alright, but several labs had vague instructions and involved the use of material that you haven't even learned yet/ had minimal experience in, which then led to you having to google everything. Labs are also must-pass even though they're only worth 10%."
1.0,4.0,0,"Very poor lecturer.Sarcastic and condescending when replying to students. Taught a lot on theory but barely touched on actual code writing, leaving students to fend for themselves during lab sessions."
1.5,5.0,0,"be ready to learn the book by heart, and then add stuff discussed in class to it. If using Big C++ it's a good idea to read till chap 8 before classes start as you'll be expected to know everything by week 3 anyway. Lects are rambles with very few concrete ideas put forth in articulate form. Wont do much to encourage an interest in comps/programmin"
2.0,3.0,0,Course felt completely disorganized. Will not teach you fundamental coding. You'll do better with online tutorials. Definitely not familiar with technical writing or good lab/lecture formatting. avoid him if possible. Thankfully there is now an alternative instructor!!! Everyone's poor ratings are accurate.
1.5,4.0,0,"Extremely boring and tedious assignments, labs and lectures.    He'll teach you lots of definitions and theories on good programming practice, but unfortunately he won't actually teach you anything practical."
2.0,3.0,0,boo
4.5,2.0,0,Very clear in explaining the concept. One of the most useful courses!
4.5,2.0,0,"Very thorough teacher.  I had no prior knowledge of C++, but it does not matter with this teacher.  Just keep up with the assignments and pay attention in class and you will see he does teach the material very well.  I did not even own the textbook and still managed to get 89% with just his lecture slides.  Definitely recommend him for the future."
1.0,4.0,0,Pretty confusing professor and WAY too long-winded (the labs and assignments feel like novels). He should probably take APSC 201 and learn a little something about the importance of being concise. The course itself also expects us to already know C++ after taking one course in C which was pretty useless as well...
1.0,5.0,0,"The course is not designed well at all, and the prof doesn't do anything to make it any better. His teaching is good in no aspects, and lacking in all. It's a shame the course is mandatory, because you'd learn more spending a bit of time on google."
1.0,5.0,0,"Probably the worst prof. I've ever had. Honestly, students should not be subjected to his lecturing. I hope no one ever has to listen to him again."
1.0,5.0,0,Avoid this prof at all costs.
2.0,3.0,0,"the course itself has more problems than the prof does. The main problem is the big gap b/w apsc160&cpsc260 for people who don't have c++ background. EECE department needs to do something about it. e.g.split it into two courses.but, the prof himself is not effective. he knew the stuff well, but he didn't know deliver the knowledge to the students."
1.5,2.0,0,Very ineffective prof. Presentations are unclear and too much irrelavent talking in class. Course materials are inorganized. Expect to learn everything by yourself. Try your best doing the labs/assignments since midterms/finals are heavily based on them. WebCT is really helpful too when you have questions or want to look up stuffs.
1.0,5.0,,- worst prof ever.  it's like he hypnotizes you into sleeping during lectures by making the simplest concept so convoluted and confusing that eventually causes the entire class to pass out. Successfully discouraged students from enjoying programming. Effective demotivator. Arrogant and has poor course structure.
4.5,3.0,,"Pretty interesting prof. Extremely helpful on webct once you ask a question. Lectures are interesting and make sense, though he often goes off topic a little by using weird analogies. Assignemts are hard, but extremely helpful to understanding."
5.0,1.0,0,Great guy!
5.0,3.0,0,"Great Prof, too bad he only did one class, if he teaches again definitely sign up."
5.0,4.0,0,"I love this guy. Seems like a genius, super clear, and very human. He's the guy that invented WebCT. Murray, will you father my child? :-)"
5.0,2.0,0,OMG do yourself a favour and take a course with him. He is so passionate about teaching that I can feel the energy coming from him. Really helpful after class and very clear in teaching. He is really knowledgeable and can communicate it effectively. LOved his class. Probably the best prof I has so far.
5.0,3.0,,"definitly recommend taking 315 with him.
 best damn prof around"
5.0,2.0,,"Excellent Professor.  He's energetic, enthustiastic, and brings clarity to the topic he discusses.  His Silicon Chalk program still needs some kinks worked out but having full recordings of his lectures definately helped my studies."
5.0,2.0,,"Awesome teacher with great enthusiasm and interest in the course.  Exams were fair and assignments, though challenging, actually made you learn stuff."
5.0,2.0,,Best teacher I've ever had.
4.0,2.0,,one of the best com sci prof. super-energetic! I really love his lecture :)
5.0,1.0,,"Great prof.  One of the 3 best at UBC imo.  Very helpful after class if you need it, but you probably won't because his explanations are great.  If you come to the lectures, you shouldn't have any problems with the tests either."
4.5,3.0,N/A,A motivated and energetic proff.  Interacts well with students and stimulates to think.
4.5,1.0,,He's a great teacher. I definately recommend taking CPSC 315 with him.
5.0,2.0,,"Excellent guy; often away on business.  Fun, clear lectures, and exams are *NOT* particularly difficult.  Routinely disorganized.  Strongly recommended"
3.0,3.0,,"When the professor is absent for more than a month during a 4-month term, nothing can be interesting -it's because he is the CEO of his own company... Maybe we have not paid enough to have a full time professor."
3.5,4.0,,Can't really ask for more. He said he loves teaching. Exams are hard.
1.5,4.0,,"Not organized, comes poorly prepared to class, rumbling, difficult to follow in lectures."
1.0,4.0,,"Absolutely terrible! The workload unjustified, and examples non-sensical."
4.5,1.0,,Very helpful and very fun. One of the best prof in compsci
5.0,2.0,,"great prof, usefull and interesting course"
4.5,3.0,,"Busy on his CEO job, so have little time for the course, but good at teaching"
1.0,3.0,A,"exams are interesting. that said he isn't a miracle worker, it's calculus and you need to do your own studying. If class was mandatory I wouldn't take him, but if you know calculus inside out and skip class he's passable"
1.5,4.0,A,really boring
1.0,5.0,A,Just terrible.
2.5,4.0,D,"Prof. Peterson is a brilliant man, but unfortunately, this doesn't translate to his teaching skills. He has a bad habit of cramming content onto a single blackboard making it difficult to read, and he still mumbles to the class. He did however recently move towards a typed exam papers. Based off past reviews here, he has shown large improvement."
4.0,3.0,D,He makes good explanation to every point we need to learn
1.5,4.0,D,"Awful prof, you will NOT learn a thing from him."
1.0,3.0,N/A,"He has no office hours, and he doesn't reply to e-mails very well. He seems to be busy after lectures to ask questions and doesn't show up to lectures until 2-3 minutes beforehand. His lectures are long, and although he is very knowledgeable, his explanations aren't always clear. Also, he uses the blackboard and his writing can get very messy."
1.0,3.0,N/A,"Stats major so I've taken a lot of Math courses. Peterson is definitely the worst prof I've never had. His writing are messy and lectures are boring and useless. He is knowledgeable, but  he is not good at teaching. If you wanna get ok mark, READ the textbook by yourself."
3.5,3.0,N/A,I do not understand why he gets such a bad rep. He is really clear in his teaching and passionate about his subject. His office hours are fantastic.
3.5,3.0,N/A,Always nice and helpful the few times I talked to him in-class. Doesn't use iclicker. Lectures are understandable but not needed to get a decent grade.  Course website is very helpful with plenty of information and problems.                     
1.0,5.0,N/A,I was verbally abused by this man. He should not be teaching. I strongly urge you to be careful if you are talking to him alone in person.
1.0,5.0,N/A,Really boring and talks too much about something pretty obvious instead of core concepts
5.0,3.0,N/A,"A fast talker, but a good teacher."
3.5,3.0,B,Prof Peterson gets a bad rep. Lots of students don't like him because he doesn't take their crap when he is teaching. (i.e. if people are talking when he is lecturing he tells them off). He is a good math prof where it matters. He is knowledgeable and good at proving where the math comes from instead of just giving formulas. go to his office hours!
1.0,5.0,B,Horrible..... Just plain horrible
1.0,5.0,B,"DO NOT TAKE! WORST PROF EVER AT UBC! he fell asleep in front of me during an office hour, very unprofessional and could not answer my questions"
1.0,5.0,B,"the worst prof I've ever had at UBC, no comparison, unbeatable! rude in class, ignore students' questions,etc. He almost made me give up math. My nightmare at UBC"
1.0,5.0,B,"writing this review in class, this is the worst prof I have ever had."
1.0,5.0,B,"Enjoys rushing through materials, and unwilling to match the learning pace of students. Results in tendency to NOT answer questions, and jarring differences in exam vs course materials. Also has a fondness for mumbling, hence often blames students for ignoring his instructions (even though his audible range is 3 feet in front of him). AVOID! AVOID!"
1.0,5.0,B,AVOID. AT. ALL. COST.
1.0,5.0,0,I trusted all those good reviews but I felt the exact opposite...
5.0,4.0,0,"Katherine Sirluck is amazing. She sincerely cares for the wellbeing and improvement of every students' work, strives for the best way to be helpful to her students, and writes the best constructive feedback that students can actually improve from. She is by far the most insightful professor I have ever taken a class in. I learned so much from her."
5.0,3.0,0,"Dr Sirluck is so engaging and inspiring! She chooses great literary works to study, shares with us her reading of the work, and encourages everyone to share their own interpretation, accepting all of them despite how vastly different they may be. She's very critical but leaves lots of good feedback, and prompts us to think further in discussions."
5.0,3.0,A+,"Sirluck is incredible, not least because she's able to make 17th century lit a fascinating subject; her lectures are downright masterworks of eloquence, though if you don't pay attention you will lose the plot; the class average was quite high, so she is not too tough a marker, or rather she is generous and open-minded, unlike many profs out there"
5.0,3.0,A+,"Honestly, one of the best professors I've had to date. I've never been overly interested in classical literature before, but she took texts that bored me to death when I'd been forced to study them before and lit them on fire. She's great."
5.0,3.0,A,"These reviews are the reason I enrolled in English 220, I was looking for something along those lines for an elective and couldn't miss the chance. Let me tell you, it's all true. Dr. Sirluck is simply the best. The course changed the way I relate to the world by encouraging me to think about it through the eyes of literature and history. Take it!"
5.0,3.0,A,"Really, really good lecturer. I've never really been into classical literature before, but I thoroughly enjoyed going to her classes."
5.0,4.0,A,"Top five if not the top of all English profs throughout my years at UBC. Highly recommend. Above all, shes fair, quick with good advice, funny and brilliant!"
4.0,3.0,A,"Super fun to listen to. Makes the texts come alive with her theatrical, dramatic readings and always engages students. She does make a ton of references that you will not get if you don't do the readings, but will undoubtedly accept any views that you have as long as you back them up. Very encouraging of independent thought, and quite funny."
5.0,3.0,A-,"Dr. Sirluck renewed my passion for my degree. Her intelligence and knowledge about Shakespeare was truly inspirational. I learned so much in every lecture and she was genuinely respectful of students, wanted to help you learn and succeed, and was born to be a teacher. Her sense of humour made every class enjoyable. The best prof I've ever had."
5.0,3.0,A,"Sirluck is without a doubt one of the best profs i've ever had. Coming into the class, I was worried it would be boring (literature up to the 18th century) but Sirluck made each reading and lecture super interesting! She allowed student discussion to bring up points she might not agree with, but still treated the opinions as valuable."
5.0,1.0,A,Professor Sirluck is the best professor of all time... aside from maybe one or two others.  Definitely the most charismatic and enthusiastic.
4.5,3.0,A,Prof. Sirluck is an amazing lecturer! I felt like I left every class having learned a lot (which can be pretty rare with a lot of English profs). Classes are always interesting and engaging and you can tell she's really passionate about the material. Very fair marker. Definitely take her class if you get the chance.
3.0,2.0,A,"Her lectures are quite informative, but I really don't understand what all the hype is about. There are many English profs at UBC who are as equally, if not more, insightful and interesting. I personally found her to be quite intimidating and condescending during office hours as well."
5.0,3.0,A,"Dr. Sirluck was fantastic-- interesting lectures with lots of discussion, really made an effort to make everything interesting. She is a very fair marker and gives great feedback. If you put in the extra work, it does not go unnoticed! She's absolutely fabulous."
4.5,2.0,N/A,"Lectures flow organically and are highly interesting and engaging. She is brilliant, witty, and has an amazing grip on the content, but is not intimidating. Rather she is inspiring and fosters a wonderful creative environment. Easy marker too, which is so rare for a prof this good! Being in her class is a privilege, I can't wait to take more."
5.0,3.0,N/A,"Prof Sirluck is absolutely in LOVE with Shakespeare, and her passion is contagious! Really encourages participation, had mini-performance groups and marks fairly based on the clarity and strength of your argument, rather than whether she agrees with it or not. She's the kind of teacher you dream of having!!"
